{
  "schema_version": "trdgl_benchmark_result_summary_v1",
  "evidence_label": "campaign",
  "benchmark": {
    "benchmark_id": "trdgl_pytorch_120_v1",
    "manifest_sha256": "d9de15ca10bdd4abef2106c58b661197f69d1f278f87eec2b6eb56845f4facac",
    "api_count": 120,
    "api_group_count": 10,
    "apis_per_group": 12,
    "generation_seeds": [
      3407,
      7711,
      12011,
      19001,
      27103
    ],
    "baselines": [
      "B0",
      "B1",
      "B2",
      "B3"
    ],
    "expected_task_count": 600,
    "expected_event_count": 2400
  },
  "source": {
    "events_path": "TrDGL-FuzzVn_paper/experiments/benchmark_120/checkpoints/seed3407_480/events.checkpoint.jsonl",
    "notebook_path": "TrDGL-FuzzVn_paper/experiments/benchmark_120/trdgl_fair_benchmark_120.ipynb",
    "events_sha256": "55e61acab475d370f6261be2041fdbb74ef5f06bd8197044df587c60a4f4af09",
    "all_run_signatures": [
      "221b2ab2bb66e6110da76ea5cde39b20fb3613e8ee3527f8818a039e7b6d8475"
    ],
    "selected_run_signature": "221b2ab2bb66e6110da76ea5cde39b20fb3613e8ee3527f8818a039e7b6d8475",
    "truncated_tail_ignored": false,
    "parsed_event_count_all_signatures": 480
  },
  "coverage": {
    "observed_event_count": 480,
    "missing_event_count": 1920,
    "unexpected_task_count": 0,
    "metadata_mismatch_count": 0,
    "missing_events_sample": [
      {
        "baseline": "B0",
        "task_id": "trdgl_pytorch_120_v1|torch.tensor|7711"
      },
      {
        "baseline": "B1",
        "task_id": "trdgl_pytorch_120_v1|torch.tensor|7711"
      },
      {
        "baseline": "B2",
        "task_id": "trdgl_pytorch_120_v1|torch.tensor|7711"
      },
      {
        "baseline": "B3",
        "task_id": "trdgl_pytorch_120_v1|torch.tensor|7711"
      },
      {
        "baseline": "B0",
        "task_id": "trdgl_pytorch_120_v1|torch.as_tensor|7711"
      },
      {
        "baseline": "B1",
        "task_id": "trdgl_pytorch_120_v1|torch.as_tensor|7711"
      },
      {
        "baseline": "B2",
        "task_id": "trdgl_pytorch_120_v1|torch.as_tensor|7711"
      },
      {
        "baseline": "B3",
        "task_id": "trdgl_pytorch_120_v1|torch.as_tensor|7711"
      },
      {
        "baseline": "B0",
        "task_id": "trdgl_pytorch_120_v1|torch.from_numpy|7711"
      },
      {
        "baseline": "B1",
        "task_id": "trdgl_pytorch_120_v1|torch.from_numpy|7711"
      },
      {
        "baseline": "B2",
        "task_id": "trdgl_pytorch_120_v1|torch.from_numpy|7711"
      },
      {
        "baseline": "B3",
        "task_id": "trdgl_pytorch_120_v1|torch.from_numpy|7711"
      },
      {
        "baseline": "B0",
        "task_id": "trdgl_pytorch_120_v1|torch.arange|7711"
      },
      {
        "baseline": "B1",
        "task_id": "trdgl_pytorch_120_v1|torch.arange|7711"
      },
      {
        "baseline": "B2",
        "task_id": "trdgl_pytorch_120_v1|torch.arange|7711"
      },
      {
        "baseline": "B3",
        "task_id": "trdgl_pytorch_120_v1|torch.arange|7711"
      },
      {
        "baseline": "B0",
        "task_id": "trdgl_pytorch_120_v1|torch.linspace|7711"
      },
      {
        "baseline": "B1",
        "task_id": "trdgl_pytorch_120_v1|torch.linspace|7711"
      },
      {
        "baseline": "B2",
        "task_id": "trdgl_pytorch_120_v1|torch.linspace|7711"
      },
      {
        "baseline": "B3",
        "task_id": "trdgl_pytorch_120_v1|torch.linspace|7711"
      }
    ],
    "unexpected_task_ids": [],
    "metadata_mismatches_sample": [],
    "by_baseline": {
      "B0": {
        "expected_events": 600,
        "observed_events": 120,
        "complete": false,
        "completion_rate": 0.2,
        "parseable_count": 120,
        "parseable_rate": 1.0,
        "ast_pass_count": 120,
        "ast_pass_rate": 1.0,
        "runnable_count": 120,
        "runnable_rate": 1.0,
        "target_valid_count": 120,
        "target_valid_rate": 1.0,
        "oracle_bearing_count": 0,
        "oracle_bearing_rate": 0.0,
        "generation_seconds_total": 0.0,
        "subprocess_seconds_total": 310.36600000000016,
        "event_wall_seconds_total": 310.6352600000001,
        "events_per_hour_event_wall": 1390.6985317764631
      },
      "B1": {
        "expected_events": 600,
        "observed_events": 120,
        "complete": false,
        "completion_rate": 0.2,
        "parseable_count": 120,
        "parseable_rate": 1.0,
        "ast_pass_count": 120,
        "ast_pass_rate": 1.0,
        "runnable_count": 105,
        "runnable_rate": 0.875,
        "target_valid_count": 72,
        "target_valid_rate": 0.6,
        "oracle_bearing_count": 1,
        "oracle_bearing_rate": 0.008333333333333333,
        "generation_seconds_total": 684.1349999999996,
        "subprocess_seconds_total": 290.19199999999995,
        "event_wall_seconds_total": 974.7742119999998,
        "events_per_hour_event_wall": 443.17955346155594
      },
      "B2": {
        "expected_events": 600,
        "observed_events": 120,
        "complete": false,
        "completion_rate": 0.2,
        "parseable_count": 65,
        "parseable_rate": 0.5416666666666666,
        "ast_pass_count": 65,
        "ast_pass_rate": 0.5416666666666666,
        "runnable_count": 64,
        "runnable_rate": 0.5333333333333333,
        "target_valid_count": 48,
        "target_valid_rate": 0.4,
        "oracle_bearing_count": 43,
        "oracle_bearing_rate": 0.35833333333333334,
        "generation_seconds_total": 2198.3279999999995,
        "subprocess_seconds_total": 179.054,
        "event_wall_seconds_total": 2378.0081050000013,
        "events_per_hour_event_wall": 181.66464575611687
      },
      "B3": {
        "expected_events": 600,
        "observed_events": 120,
        "complete": false,
        "completion_rate": 0.2,
        "parseable_count": 2,
        "parseable_rate": 0.016666666666666666,
        "ast_pass_count": 2,
        "ast_pass_rate": 0.016666666666666666,
        "runnable_count": 1,
        "runnable_rate": 0.008333333333333333,
        "target_valid_count": 0,
        "target_valid_rate": 0.0,
        "oracle_bearing_count": 0,
        "oracle_bearing_rate": 0.0,
        "generation_seconds_total": 2285.255999999999,
        "subprocess_seconds_total": 9.374,
        "event_wall_seconds_total": 2295.2332989999995,
        "events_per_hour_event_wall": 188.21616094024787
      }
    },
    "by_seed": {
      "3407": {
        "expected_events": 480,
        "observed_events": 480,
        "complete": true,
        "completion_rate": 1.0,
        "parseable_count": 307,
        "parseable_rate": 0.6395833333333333,
        "ast_pass_count": 307,
        "ast_pass_rate": 0.6395833333333333,
        "runnable_count": 290,
        "runnable_rate": 0.6041666666666666,
        "target_valid_count": 240,
        "target_valid_rate": 0.5,
        "oracle_bearing_count": 44,
        "oracle_bearing_rate": 0.09166666666666666,
        "generation_seconds_total": 5167.719,
        "subprocess_seconds_total": 788.9859999999998,
        "event_wall_seconds_total": 5958.650876000006,
        "events_per_hour_event_wall": 289.9985308687849
      },
      "7711": {
        "expected_events": 480,
        "observed_events": 0,
        "complete": false,
        "completion_rate": 0.0,
        "parseable_count": 0,
        "parseable_rate": null,
        "ast_pass_count": 0,
        "ast_pass_rate": null,
        "runnable_count": 0,
        "runnable_rate": null,
        "target_valid_count": 0,
        "target_valid_rate": null,
        "oracle_bearing_count": 0,
        "oracle_bearing_rate": null,
        "generation_seconds_total": null,
        "subprocess_seconds_total": null,
        "event_wall_seconds_total": null,
        "events_per_hour_event_wall": null
      },
      "12011": {
        "expected_events": 480,
        "observed_events": 0,
        "complete": false,
        "completion_rate": 0.0,
        "parseable_count": 0,
        "parseable_rate": null,
        "ast_pass_count": 0,
        "ast_pass_rate": null,
        "runnable_count": 0,
        "runnable_rate": null,
        "target_valid_count": 0,
        "target_valid_rate": null,
        "oracle_bearing_count": 0,
        "oracle_bearing_rate": null,
        "generation_seconds_total": null,
        "subprocess_seconds_total": null,
        "event_wall_seconds_total": null,
        "events_per_hour_event_wall": null
      },
      "19001": {
        "expected_events": 480,
        "observed_events": 0,
        "complete": false,
        "completion_rate": 0.0,
        "parseable_count": 0,
        "parseable_rate": null,
        "ast_pass_count": 0,
        "ast_pass_rate": null,
        "runnable_count": 0,
        "runnable_rate": null,
        "target_valid_count": 0,
        "target_valid_rate": null,
        "oracle_bearing_count": 0,
        "oracle_bearing_rate": null,
        "generation_seconds_total": null,
        "subprocess_seconds_total": null,
        "event_wall_seconds_total": null,
        "events_per_hour_event_wall": null
      },
      "27103": {
        "expected_events": 480,
        "observed_events": 0,
        "complete": false,
        "completion_rate": 0.0,
        "parseable_count": 0,
        "parseable_rate": null,
        "ast_pass_count": 0,
        "ast_pass_rate": null,
        "runnable_count": 0,
        "runnable_rate": null,
        "target_valid_count": 0,
        "target_valid_rate": null,
        "oracle_bearing_count": 0,
        "oracle_bearing_rate": null,
        "generation_seconds_total": null,
        "subprocess_seconds_total": null,
        "event_wall_seconds_total": null,
        "events_per_hour_event_wall": null
      }
    }
  },
  "fairness": {
    "same_harness_run_signature": true,
    "configuration_equivalence_verified": false,
    "harness_equivalence_verified": true,
    "observed_run_signature_counts": {
      "221b2ab2bb66e6110da76ea5cde39b20fb3613e8ee3527f8818a039e7b6d8475": 480
    },